{
  "schema_version": "18.0",
  "style_lock": "AFRO_HOUSE_SA + light AFRO_CUBAN principle",
  "bpm": 122,
  "meter": {
    "numerator": 4,
    "denominator": 4
  },
  "ppq": 960,
  "bars": 2,
  "pulse": "quarter-note house pulse",
  "timeline": {
    "pattern_id": "afro_house_interlock_v18",
    "orientation": null,
    "evidence": {
      "level": "HEUR",
      "source_ids": [
        "BEATPORT_AFRO_001",
        "SMITHSONIAN_BELL_001"
      ]
    }
  },
  "timing_profile": "POCKET_LIGHT",
  "roles": [
    {
      "role_id": "kick",
      "function": "BACKBONE",
      "track_name": "KICK",
      "midi_note": 36,
      "events": [
        {
          "bar": 1,
          "beat": 0,
          "duration_beats": 0.12,
          "velocity": 112,
          "micro_offset_beats": 0,
          "articulation": "short"
        },
        {
          "bar": 1,
          "beat": 1,
          "duration_beats": 0.12,
          "velocity": 112,
          "micro_offset_beats": 0,
          "articulation": "short"
        },
        {
          "bar": 1,
          "beat": 2,
          "duration_beats": 0.12,
          "velocity": 112,
          "micro_offset_beats": 0,
          "articulation": "short"
        },
        {
          "bar": 1,
          "beat": 3,
          "duration_beats": 0.12,
          "velocity": 112,
          "micro_offset_beats": 0,
          "articulation": "short"
        },
        {
          "bar": 2,
          "beat": 0,
          "duration_beats": 0.12,
          "velocity": 112,
          "micro_offset_beats": 0,
          "articulation": "short"
        },
        {
          "bar": 2,
          "beat": 1,
          "duration_beats": 0.12,
          "velocity": 112,
          "micro_offset_beats": 0,
          "articulation": "short"
        },
        {
          "bar": 2,
          "beat": 2,
          "duration_beats": 0.12,
          "velocity": 112,
          "micro_offset_beats": 0,
          "articulation": "short"
        },
        {
          "bar": 2,
          "beat": 3,
          "duration_beats": 0.12,
          "velocity": 112,
          "micro_offset_beats": 0,
          "articulation": "short"
        }
      ]
    },
    {
      "role_id": "timeline",
      "function": "TIMELINE",
      "track_name": "PERC_TIMELINE",
      "midi_note": 37,
      "events": [
        {
          "bar": 1,
          "beat": 0,
          "duration_beats": 0.08,
          "velocity": 96,
          "micro_offset_beats": 0,
          "articulation": "short"
        },
        {
          "bar": 1,
          "beat": 0.75,
          "duration_beats": 0.08,
          "velocity": 96,
          "micro_offset_beats": 0,
          "articulation": "short"
        },
        {
          "bar": 1,
          "beat": 1.75,
          "duration_beats": 0.08,
          "velocity": 96,
          "micro_offset_beats": 0,
          "articulation": "short"
        },
        {
          "bar": 1,
          "beat": 2.75,
          "duration_beats": 0.08,
          "velocity": 96,
          "micro_offset_beats": 0,
          "articulation": "short"
        },
        {
          "bar": 1,
          "beat": 3.75,
          "duration_beats": 0.08,
          "velocity": 96,
          "micro_offset_beats": 0,
          "articulation": "short"
        },
        {
          "bar": 2,
          "beat": 0.5,
          "duration_beats": 0.08,
          "velocity": 96,
          "micro_offset_beats": 0,
          "articulation": "short"
        },
        {
          "bar": 2,
          "beat": 1.5,
          "duration_beats": 0.08,
          "velocity": 96,
          "micro_offset_beats": 0,
          "articulation": "short"
        },
        {
          "bar": 2,
          "beat": 2.5,
          "duration_beats": 0.08,
          "velocity": 96,
          "micro_offset_beats": 0,
          "articulation": "short"
        },
        {
          "bar": 2,
          "beat": 3.5,
          "duration_beats": 0.08,
          "velocity": 96,
          "micro_offset_beats": 0,
          "articulation": "short"
        }
      ]
    },
    {
      "role_id": "mid",
      "function": "MID_PERC",
      "track_name": "PERC_MID",
      "midi_note": 39,
      "events": [
        {
          "bar": 1,
          "beat": 0.75,
          "duration_beats": 0.09,
          "velocity": 84,
          "micro_offset_beats": -0.01,
          "articulation": "short"
        },
        {
          "bar": 1,
          "beat": 2.25,
          "duration_beats": 0.09,
          "velocity": 92,
          "micro_offset_beats": -0.01,
          "articulation": "short"
        },
        {
          "bar": 2,
          "beat": 1.5,
          "duration_beats": 0.09,
          "velocity": 86,
          "micro_offset_beats": -0.01,
          "articulation": "short"
        },
        {
          "bar": 2,
          "beat": 3.25,
          "duration_beats": 0.09,
          "velocity": 94,
          "micro_offset_beats": -0.01,
          "articulation": "short"
        }
      ]
    },
    {
      "role_id": "high",
      "function": "HIGH_TIMEKEEPER",
      "track_name": "SHAKER",
      "midi_note": 42,
      "events": [
        {
          "bar": 1,
          "beat": 0,
          "duration_beats": 0.07,
          "velocity": 68,
          "micro_offset_beats": 0.01,
          "articulation": "short"
        },
        {
          "bar": 1,
          "beat": 0.5,
          "duration_beats": 0.07,
          "velocity": 74,
          "micro_offset_beats": 0.01,
          "articulation": "short"
        },
        {
          "bar": 1,
          "beat": 1,
          "duration_beats": 0.07,
          "velocity": 80,
          "micro_offset_beats": 0.01,
          "articulation": "short"
        },
        {
          "bar": 1,
          "beat": 1.5,
          "duration_beats": 0.07,
          "velocity": 68,
          "micro_offset_beats": 0.01,
          "articulation": "short"
        },
        {
          "bar": 1,
          "beat": 2,
          "duration_beats": 0.07,
          "velocity": 74,
          "micro_offset_beats": 0.01,
          "articulation": "short"
        },
        {
          "bar": 1,
          "beat": 2.5,
          "duration_beats": 0.07,
          "velocity": 80,
          "micro_offset_beats": 0.01,
          "articulation": "short"
        },
        {
          "bar": 1,
          "beat": 3,
          "duration_beats": 0.07,
          "velocity": 68,
          "micro_offset_beats": 0.01,
          "articulation": "short"
        },
        {
          "bar": 1,
          "beat": 3.5,
          "duration_beats": 0.07,
          "velocity": 74,
          "micro_offset_beats": 0.01,
          "articulation": "short"
        },
        {
          "bar": 2,
          "beat": 0,
          "duration_beats": 0.07,
          "velocity": 68,
          "micro_offset_beats": 0.01,
          "articulation": "short"
        },
        {
          "bar": 2,
          "beat": 0.5,
          "duration_beats": 0.07,
          "velocity": 74,
          "micro_offset_beats": 0.01,
          "articulation": "short"
        },
        {
          "bar": 2,
          "beat": 1,
          "duration_beats": 0.07,
          "velocity": 80,
          "micro_offset_beats": 0.01,
          "articulation": "short"
        },
        {
          "bar": 2,
          "beat": 1.5,
          "duration_beats": 0.07,
          "velocity": 68,
          "micro_offset_beats": 0.01,
          "articulation": "short"
        },
        {
          "bar": 2,
          "beat": 2,
          "duration_beats": 0.07,
          "velocity": 74,
          "micro_offset_beats": 0.01,
          "articulation": "short"
        },
        {
          "bar": 2,
          "beat": 2.5,
          "duration_beats": 0.07,
          "velocity": 80,
          "micro_offset_beats": 0.01,
          "articulation": "short"
        },
        {
          "bar": 2,
          "beat": 3,
          "duration_beats": 0.07,
          "velocity": 68,
          "micro_offset_beats": 0.01,
          "articulation": "short"
        },
        {
          "bar": 2,
          "beat": 3.5,
          "duration_beats": 0.07,
          "velocity": 74,
          "micro_offset_beats": 0.01,
          "articulation": "short"
        }
      ]
    }
  ],
  "evidence": {
    "level": "HEUR",
    "source_ids": [
      "BEATPORT_AFRO_001",
      "SMITHSONIAN_BELL_001"
    ]
  }
}
